Agent_ID,Agent_Name,Agent_Type,Development_Status,Production_Status,GitHub_Workflow,Lines_of_Code,Primary_Function,Trigger_Method,Performance_Metrics,Last_Updated,Epic_Integration,Dependencies,Notes
epic-breakdown-agent-v1,Epic Breakdown Agent,GitHub Actions Workflow,✅ Complete,✅ Operational,.github/workflows/epic-breakdown-agent.yml,     889,Epic → Stories → Tasks breakdown with GitHub Project integration,Comment-triggered by AI Agent Orchestrator,100% success rate - Epic #60 → 8 Stories + 24 Tasks,2025-08-31,Epic 1 Core Agent,GitHub API + PROJECT_TOKEN + GitHub CLI,Multi-mode operation validated - Core agent for project management automation
scrum-master-agent-v1,Scrum Master Agent,GitHub Actions Workflow,✅ Complete,✅ Operational,.github/workflows/scrum-master-agent.yml,     262,Story lifecycle management and development workflow coordination,Comment-triggered on story issues,100% success - Story #54 lifecycle management,2025-08-31,Epic 1 Core Agent,GitHub Issues API + GitHub Projects API,Intelligent label filtering - Development Agent handoff validated
development-agent-v1,Development Agent (Enhanced),GitHub Actions Workflow,✅ Complete,✅ Operational,.github/workflows/development-agent.yml,     631,Enhanced story implementation with modular task processing and proven e2e workflow,Scrum Master Agent handoff,100% story completion - Story #54 validated + enhanced modular capabilities,2025-08-31,Epic 1 Core Agent,GitHub API + Scrum Master Agent coordination + Enhanced modular task handlers,Enhanced version: proven v1 core logic + v2 modular handlers - no regressions - specialized task processing
project-admin-agent-v1,Project Admin Agent,GitHub Actions Workflow,✅ Complete,✅ Operational,.github/workflows/project-admin-agent.yml,     322,Automated PR review approval and merge with intelligent risk assessment,Development Agent PR creation,100% auto-merge success - PR #65 low-risk validation,2025-08-31,Epic 1 Core Agent,PROJECT_TOKEN + GitHub Projects API + Risk Assessment Logic,Multi-criteria risk assessment + auto-merge + comprehensive review comments + branch cleanup
project-cleanup-agent-v1,Project Cleanup Agent,GitHub Actions Workflow,✅ Complete,✅ Operational,.github/workflows/project-cleanup-agent.yml,     279,GitHub Project hygiene and orphaned item management,Scheduled (Monday 6 AM UTC) + manual dispatch,100% operational - orphaned item detection working,2025-08-31,Epic 1 Core Agent,GitHub Projects API,Weekly maintenance automation + project integrity validation
ai-agent-orchestrator-v1,AI Agent Orchestrator,GitHub Actions Workflow,✅ Complete,✅ Operational,.github/workflows/ai-agent-orchestrator.yml,     137,Central dispatcher with intelligent routing and agent selection,Issue creation with automated label analysis,Real-time dispatch with notification systems,2025-08-31,Epic 1 Core Agent,Cross-agent communication protocols,Central coordination hub for all 12 agents
epic-task-orchestrator-v1,Epic Task Orchestrator,GitHub Actions Workflow,✅ Complete,✅ Operational,.github/workflows/epic-task-orchestrator.yml,     277,Project management engine with GitHub Projects integration,Epic processing requests,Complete Epic processing with observatory tracking,2025-08-31,Epic 1 Core Agent,GitHub Projects API + dependency management,Cross-Epic coordination and workflow management
find-replace-agent-v1,Find/Replace Agent,GitHub Actions Workflow,✅ Complete,✅ Operational,.github/workflows/find-replace-agent.yml,     369,Repository-wide transformation with pattern validation,Manual trigger with pattern specifications,Repository-wide operations in <5 minutes,2025-08-31,Epic 1 Core Agent,Automated branch creation + PR generation,Multi-file scope analysis with rollback safety
github-issue-comment-agent-v1,GitHub Issue Comment Agent,Reusable GitHub Workflow,✅ Complete,✅ Operational,.github/workflows/github-issue-comment-agent.yml,     178,Standardized communication protocol across all agents,Called by other agents for status reporting,Instant communication and status updates,2025-08-31,Epic 1 Core Agent,Cross-agent coordination,Reusable workflow for standardized agent communication
observatory-monitoring-v1,Observatory Monitoring Agent,GitHub Actions Workflow,✅ Complete,✅ Operational,.github/workflows/observatory-monitoring.yml,      60,Real-time agent activity tracking and system monitoring,Scheduled 15-minute cycles,15-minute continuous monitoring operational,2025-08-31,Epic 1 Core Agent,CloudWatch integration + agent status APIs,Foundation for Epic 2 Observatory Dashboard
ci-cd-pipeline-v1,CI/CD Pipeline Agent,GitHub Actions Workflow,✅ Complete,✅ Operational,.github/workflows/ci-cd.yml,     243,5-stage automated build and deployment pipeline,Push/PR triggers,100% workflow success rate - <10 minutes execution,2025-08-31,Epic 1 Core Agent,TypeScript + ESLint + Vitest + Trivy + Vite,Quality assurance + testing + security + build + observatory integration
well-architected-compliance-v1,AWS Well-Architected Compliance Agent,GitHub Actions Workflow,✅ Complete,✅ Operational,.github/workflows/well-architected-compliance.yml,      67,Six-pillar framework compliance validation and reporting,Manual trigger + Epic 3 activation,Prepared for AWS deployment validation,2025-08-31,Epic 3 Preparation,AWS APIs + Terraform + CloudWatch,Enterprise compliance framework for AWS migration
agent-storygen-v2,StoryGen Agent,AI Service Agent,🔄 In Development,🚧 Epic 2 Development,TBD,TBD,Interactive narrative generation and story development,Story theme issues + scheduled generation,Target: 85%+ user completion rate,2025-08-31,Epic 2 Core Development,Claude-3-Opus + content moderation API + grammar checking,Creative writing optimized with accessibility compliance and zero emoji enforcement
agent-infraopt-v1,InfraOpt Agent,AI Service Agent,📋 Planned,🚧 Epic 3 Development,TBD,TBD,Infrastructure optimization and cost management,CloudWatch alerts + scheduled reviews + vulnerability notifications,Target: 20%+ AWS cost reduction + 95%+ uptime,2025-08-31,Epic 3 Core Development,AWS CLI + Terraform + CloudWatch + security scanning,Technical analysis focused for infrastructure optimization and cost management
agent-observatory-v1,Observatory Agent,AI Service Agent,🔄 In Development,🚧 Epic 2 Development,TBD,TBD,Comprehensive AI agent monitoring and coordination dashboard,Real-time continuous monitoring + anomaly detection,Target: 99.9%+ dashboard uptime + <1s latency,2025-08-31,Epic 2 Core Platform,CloudWatch Logs + WebSocket + Grafana + custom metrics API,Real-time visualization for all agents with 90-day data retention
agent-qualityguard-v1,QualityGuard Agent,AI Service Agent,🔄 In Development,🚧 Epic 2 Development,TBD,TBD,Code quality assurance and automated testing,PR creation + code commits + scheduled audits,Target: 95%+ code quality + 90%+ test coverage,2025-08-31,Epic 2 Quality Assurance,ESLint + Jest/Vitest + SonarCloud + Snyk + performance regression,Code analysis optimized for quality enforcement and security scanning
agent-deploymaster-v1,DeployMaster Agent,AI Service Agent,📋 Planned,🚧 Epic 3 Development,TBD,TBD,Automated deployment and release management,PR merge + release tag + hotfix requests,Target: 99%+ deployment success + <5min deployment + <2min rollback,2025-08-31,Epic 3 Deployment Ops,GitHub Actions + AWS CodeDeploy + CloudFormation + Route53,Multi-environment orchestration with blue-green deployment and zero downtime
agent-secureops-v1,SecureOps Agent,AI Service Agent,📋 Planned,🚧 Epic 3 Development,TBD,TBD,Security monitoring and incident response,Security alerts + vulnerability scans + unauthorized access,Target: <5min detection to response + 100% compliance + 30-day secret rotation,2025-08-31,Epic 3 Security Ops,AWS GuardDuty + Systems Manager + GitHub Secret Scanning + OWASP ZAP,Security-focused conservative analysis with automated incident response and compliance
agent-experimentlab-v1,ExperimentLab Agent,AI Service Agent,🔄 In Development,🚧 Epic 2 Development,TBD,TBD,A/B testing and prompt optimization,Scheduled cycles + performance alerts + engagement thresholds,Target: 80%+ statistically significant results + 5+ experiments/week + 15%+ optimization gains,2025-08-31,Epic 2 Optimization,Statistical analysis + A/B testing framework + user analytics,Experimental design for prompt optimization and user experience testing
agent-debugmaster-v1,DebugMaster Agent,AI Service Agent,🔄 In Development,🚧 Epic 2 Development,TBD,TBD,Automated debugging and issue resolution,Error log anomalies + user bug reports + failed tests,Target: 85%+ automated fixes + <2hr resolution + <5% false positives,2025-08-31,Epic 2 Quality Assurance,Sentry + test automation + version control + centralized logging,Debugging optimized for root cause analysis and knowledge base maintenance
agent-datasage-v1,DataSage Agent,AI Service Agent,📋 Planned,🚧 Epic 3 Development,TBD,TBD,Data analysis and business intelligence,Scheduled analytics + metric alerts + insight requests,Target: 90%+ prediction reliability + daily reports + 24hr trend detection,2025-08-31,Epic 3 Analytics,AWS QuickSight + CloudWatch Insights + user analytics database,Data analysis optimized for business insights and predictive user engagement
